{
  "$schema": "http://json-schema.org/schema#",
  "$id": "http://chharvey.github.io/resume/resume.schema.json",
  "title": "Resume",
  "description": "Resume of Christopher H. Harvey of Fairfax, VA.",
  "definitions": {},
  "type": "object",
  "required": ["contact"],
  "additionalProperties": false,
  "properties": {
    "contact": {},
    "skills": {},
    "positions": {},
    "degrees": {},
    "prodevs": {},
    "awards": {},
    "teams": {}
  }
}
