{
  "contact": [
    {
      "url"     : "tel:+17035072467",
      "octicon" : "octicon-device-mobile",
      "itemprop": "telephone",
      "content" : "(703) 507-2467"
    },
    {
      "url"     : "mailto:chrisharvey2pi@gmail.com",
      "octicon" : "octicon-mail",
      "itemprop": "email",
      "content" : "chrisharvey2pi@gmail.com"
    },
    {
      "url"     : "https://chharvey.github.io/",
      "octicon" : "octicon-home",
      "itemprop": "url",
      "content" : "chharvey.github.io"
    }
  ],
  "skills": {},
  "positions": {},
  "degrees": {},
  "prodevs": {},
  "awards": {},
  "teams": {}
}
